{
  "schema_version": 1,
  "generated_at": "2026-09-13T01:59:38.120885+00:00",
  "slow_threshold_ms": 3000,
  "source_runs": [
    "escritorio-windows-2026-09-10"
  ],
  "cells": {
    "win32|ascii_ui_view|*": {
      "framework": "win32",
      "tool": "ascii_ui_view",
      "uia_role": "*",
      "samples": 0,
      "p50_ms": null,
      "p95_ms": null,
      "min_ms": null,
      "max_ms": null,
      "ok_count": 1,
      "slow_count": 0,
      "fail_count": 0,
      "last_ts": "2026-09-10T22:51:10-03:00",
      "run_ids": [
        "escritorio-windows-2026-09-10"
      ]
    },
    "win32|click_element|*": {
      "framework": "win32",
      "tool": "click_element",
      "uia_role": "*",
      "samples": 32,
      "p50_ms": 1032,
      "p95_ms": 5549,
      "min_ms": 0,
      "max_ms": 7006,
      "ok_count": 19,
      "slow_count": 9,
      "fail_count": 7,
      "last_ts": "2026-09-10T24:42:01-03:00",
      "run_ids": [
        "escritorio-windows-2026-09-10"
      ]
    },
    "win32|discover_control_interaction|*": {
      "framework": "win32",
      "tool": "discover_control_interaction",
      "uia_role": "*",
      "samples": 0,
      "p50_ms": null,
      "p95_ms": null,
      "min_ms": null,
      "max_ms": null,
      "ok_count": 1,
      "slow_count": 0,
      "fail_count": 0,
      "last_ts": "2026-09-10T24:06:08-03:00",
      "run_ids": [
        "escritorio-windows-2026-09-10"
      ]
    },
    "win32|element_exists|*": {
      "framework": "win32",
      "tool": "element_exists",
      "uia_role": "*",
      "samples": 6,
      "p50_ms": 800,
      "p95_ms": 1375,
      "min_ms": 300,
      "max_ms": 1500,
      "ok_count": 4,
      "slow_count": 0,
      "fail_count": 2,
      "last_ts": "2026-09-10T22:13:00-0300",
      "run_ids": [
        "escritorio-windows-2026-09-10"
      ]
    },
    "win32|expand_collapse_element|*": {
      "framework": "win32",
      "tool": "expand_collapse_element",
      "uia_role": "*",
      "samples": 0,
      "p50_ms": null,
      "p95_ms": null,
      "min_ms": null,
      "max_ms": null,
      "ok_count": 2,
      "slow_count": 0,
      "fail_count": 1,
      "last_ts": "2026-09-10T23:23:00-03:00",
      "run_ids": [
        "escritorio-windows-2026-09-10"
      ]
    },
    "win32|expand_element|*": {
      "framework": "win32",
      "tool": "expand_element",
      "uia_role": "*",
      "samples": 22,
      "p50_ms": 1049,
      "p95_ms": 23773,
      "min_ms": 304,
      "max_ms": 31464,
      "ok_count": 18,
      "slow_count": 3,
      "fail_count": 1,
      "last_ts": "2026-09-10T24:42:02-03:00",
      "run_ids": [
        "escritorio-windows-2026-09-10"
      ]
    },
    "win32|find_element|*": {
      "framework": "win32",
      "tool": "find_element",
      "uia_role": "*",
      "samples": 120,
      "p50_ms": 748,
      "p95_ms": 25333,
      "min_ms": 106,
      "max_ms": 55614,
      "ok_count": 98,
      "slow_count": 5,
      "fail_count": 17,
      "last_ts": "2026-09-11T12:10:00-03:00",
      "run_ids": [
        "escritorio-windows-2026-09-10"
      ]
    },
    "win32|find_element|ListItem": {
      "framework": "win32",
      "tool": "find_element",
      "uia_role": "ListItem",
      "samples": 1,
      "p50_ms": 1080,
      "p95_ms": 1080,
      "min_ms": 1080,
      "max_ms": 1080,
      "ok_count": 1,
      "slow_count": 0,
      "fail_count": 0,
      "last_ts": "2026-09-10T22:40:18-03:00",
      "run_ids": [
        "escritorio-windows-2026-09-10"
      ]
    },
    "win32|find_element|TabItem": {
      "framework": "win32",
      "tool": "find_element",
      "uia_role": "TabItem",
      "samples": 3,
      "p50_ms": 568,
      "p95_ms": 746,
      "min_ms": 513,
      "max_ms": 766,
      "ok_count": 3,
      "slow_count": 0,
      "fail_count": 0,
      "last_ts": "2026-09-10T23:11:35-03:00",
      "run_ids": [
        "escritorio-windows-2026-09-10"
      ]
    },
    "win32|get_focused_element|*": {
      "framework": "win32",
      "tool": "get_focused_element",
      "uia_role": "*",
      "samples": 0,
      "p50_ms": null,
      "p95_ms": null,
      "min_ms": null,
      "max_ms": null,
      "ok_count": 3,
      "slow_count": 0,
      "fail_count": 0,
      "last_ts": "2026-09-10T23:50:08-03:00",
      "run_ids": [
        "escritorio-windows-2026-09-10"
      ]
    },
    "win32|get_snapshot|*": {
      "framework": "win32",
      "tool": "get_snapshot",
      "uia_role": "*",
      "samples": 19,
      "p50_ms": 0,
      "p95_ms": 0,
      "min_ms": 0,
      "max_ms": 0,
      "ok_count": 25,
      "slow_count": 0,
      "fail_count": 0,
      "last_ts": "2026-09-10T24:40:01-03:00",
      "run_ids": [
        "escritorio-windows-2026-09-10"
      ]
    },
    "win32|invoke_element|*": {
      "framework": "win32",
      "tool": "invoke_element",
      "uia_role": "*",
      "samples": 92,
      "p50_ms": 950,
      "p95_ms": 4626,
      "min_ms": 110,
      "max_ms": 7821,
      "ok_count": 78,
      "slow_count": 9,
      "fail_count": 5,
      "last_ts": "2026-09-11T12:10:00-03:00",
      "run_ids": [
        "escritorio-windows-2026-09-10"
      ]
    },
    "win32|list_elements|*": {
      "framework": "win32",
      "tool": "list_elements",
      "uia_role": "*",
      "samples": 7,
      "p50_ms": 10589,
      "p95_ms": 19354,
      "min_ms": 1648,
      "max_ms": 19619,
      "ok_count": 6,
      "slow_count": 1,
      "fail_count": 0,
      "last_ts": "2026-09-10T24:16:05-03:00",
      "run_ids": [
        "escritorio-windows-2026-09-10"
      ]
    },
    "win32|list_elements|Button": {
      "framework": "win32",
      "tool": "list_elements",
      "uia_role": "Button",
      "samples": 9,
      "p50_ms": 12513,
      "p95_ms": 18667,
      "min_ms": 10583,
      "max_ms": 19721,
      "ok_count": 9,
      "slow_count": 0,
      "fail_count": 0,
      "last_ts": "2026-09-10T23:34:35-03:00",
      "run_ids": [
        "escritorio-windows-2026-09-10"
      ]
    },
    "win32|list_elements|CheckBox": {
      "framework": "win32",
      "tool": "list_elements",
      "uia_role": "CheckBox",
      "samples": 1,
      "p50_ms": 10937,
      "p95_ms": 10937,
      "min_ms": 10937,
      "max_ms": 10937,
      "ok_count": 1,
      "slow_count": 0,
      "fail_count": 0,
      "last_ts": "2026-09-10T23:03:30-03:00",
      "run_ids": [
        "escritorio-windows-2026-09-10"
      ]
    },
    "win32|list_elements|Edit": {
      "framework": "win32",
      "tool": "list_elements",
      "uia_role": "Edit",
      "samples": 1,
      "p50_ms": 16307,
      "p95_ms": 16307,
      "min_ms": 16307,
      "max_ms": 16307,
      "ok_count": 1,
      "slow_count": 0,
      "fail_count": 0,
      "last_ts": "2026-09-10T22:47:35-03:00",
      "run_ids": [
        "escritorio-windows-2026-09-10"
      ]
    },
    "win32|list_elements|Link": {
      "framework": "win32",
      "tool": "list_elements",
      "uia_role": "Link",
      "samples": 0,
      "p50_ms": null,
      "p95_ms": null,
      "min_ms": null,
      "max_ms": null,
      "ok_count": 1,
      "slow_count": 0,
      "fail_count": 0,
      "last_ts": "2026-09-10T23:58:12-03:00",
      "run_ids": [
        "escritorio-windows-2026-09-10"
      ]
    },
    "win32|list_elements|ListItem": {
      "framework": "win32",
      "tool": "list_elements",
      "uia_role": "ListItem",
      "samples": 6,
      "p50_ms": 1560,
      "p95_ms": 11311,
      "min_ms": 173,
      "max_ms": 14366,
      "ok_count": 6,
      "slow_count": 0,
      "fail_count": 0,
      "last_ts": "2026-09-10T23:27:06-03:00",
      "run_ids": [
        "escritorio-windows-2026-09-10"
      ]
    },
    "win32|list_elements|MenuItem": {
      "framework": "win32",
      "tool": "list_elements",
      "uia_role": "MenuItem",
      "samples": 8,
      "p50_ms": 1236,
      "p95_ms": 1564,
      "min_ms": 895,
      "max_ms": 1606,
      "ok_count": 8,
      "slow_count": 0,
      "fail_count": 0,
      "last_ts": "2026-09-10T24:02:15-03:00",
      "run_ids": [
        "escritorio-windows-2026-09-10"
      ]
    },
    "win32|list_elements|RadioButton": {
      "framework": "win32",
      "tool": "list_elements",
      "uia_role": "RadioButton",
      "samples": 1,
      "p50_ms": 9713,
      "p95_ms": 9713,
      "min_ms": 9713,
      "max_ms": 9713,
      "ok_count": 1,
      "slow_count": 0,
      "fail_count": 0,
      "last_ts": "2026-09-10T22:47:25-03:00",
      "run_ids": [
        "escritorio-windows-2026-09-10"
      ]
    },
    "win32|list_elements|SplitButton": {
      "framework": "win32",
      "tool": "list_elements",
      "uia_role": "SplitButton",
      "samples": 4,
      "p50_ms": 9972,
      "p95_ms": 12875,
      "min_ms": 8484,
      "max_ms": 13310,
      "ok_count": 4,
      "slow_count": 0,
      "fail_count": 0,
      "last_ts": "2026-09-10T23:50:38-03:00",
      "run_ids": [
        "escritorio-windows-2026-09-10"
      ]
    },
    "win32|list_elements|TabItem": {
      "framework": "win32",
      "tool": "list_elements",
      "uia_role": "TabItem",
      "samples": 1,
      "p50_ms": 358,
      "p95_ms": 358,
      "min_ms": 358,
      "max_ms": 358,
      "ok_count": 1,
      "slow_count": 0,
      "fail_count": 0,
      "last_ts": "2026-09-10T22:47:10-03:00",
      "run_ids": [
        "escritorio-windows-2026-09-10"
      ]
    },
    "win32|list_elements|Tree": {
      "framework": "win32",
      "tool": "list_elements",
      "uia_role": "Tree",
      "samples": 1,
      "p50_ms": 11911,
      "p95_ms": 11911,
      "min_ms": 11911,
      "max_ms": 11911,
      "ok_count": 1,
      "slow_count": 0,
      "fail_count": 0,
      "last_ts": "2026-09-10T22:51:20-03:00",
      "run_ids": [
        "escritorio-windows-2026-09-10"
      ]
    },
    "win32|list_elements|TreeItem": {
      "framework": "win32",
      "tool": "list_elements",
      "uia_role": "TreeItem",
      "samples": 3,
      "p50_ms": 2428,
      "p95_ms": 2827,
      "min_ms": 940,